### ISSUE TITLE
deploy Kafka & TDengine with kubernetes , writing error 

### ISSUE THREAD

**Issue by stringhuang** [taosdata/TDengine#5870]
我的kubernetes workder有三个节点，分别是node1, node2, node3。
然后时序数据库tdengine（版本2.0.16）也是三个节点，分别也部署在node1, node2, node3。
还有一个kafka单节点部署在node2。备注：tdengine和kafka都是非k8s服务。

系统有一个java程序会消费kafka的消息，把数据写入tdengine。
我使用docker build的方式把程序打包成镜像，
然后，使用docker run的方式启动该镜像，在node1, node2分别运行，程序健壮稳定运行，
qps维持在100左右，消费kafka消息，写入tdengine 百万级数据，没有任何报错信息

把上面以docker run方式启动的两个实例关闭后，
使用k8s 部署该镜像，程序启动后，往tdengine写入数据，mybatis-plus 日志正常显示为：

Preparing: insert into 's_device_299999000002' ( 'ts', 'printer_printerstate', 'printer_photometerstate', ......
Parameters: 299999000002(String), 2021-04-20 11:30:15.0(Timestamp), 1(Short), ......
Updates: 1

运行一段时间后，比如运行3分钟后，会随机发生程序被卡住现象，报错的日志显示为：

Preparing: insert into 's_device_299999000002' ( 'ts', 'printer_printerstate', 'printer_photometerstate', ......
Parameters: 299999000002(String), 2021-04-20 11:30:15.0(Timestamp), 1(Short), ......

即是停留在提交sql后，一直不返回受影响行数，从而阻塞整个程序。

之前一直怀疑tdengine的写入瓶颈，或者是kafka的消费poll瓶颈，但是通过第一种方式运行程序已经排除。

两种方式对比的差异，仅仅是程序是运行在主机和k8s环境里的区别。

程序运行在k8s环境，流量要经过kube-proxy，到calico插件，再到具体的技术中间件，这是我想到的唯一差异点。

另外观察到的一个现象就是sql内容，发送到tdengine的时候是被"截断"的，例如，

sql显示为 insert into 's_start_stop_299999000030' ( ts, device_state  ) USING s_start_stop (device_sn) TAGS (?) values( ?, ?  )
但是报错信息却是 TDengine Error: invalid SQL: '( ts, device_state  )  values( '2021-04-20 11:31:57.0', 1  )' (keyword TAGS expected)
明显的，中间那一段sql 'USING s_start_stop (device_sn) TAGS (?) '，貌似tdengine没有收到，类似于执行了以下sql

taos> insert into 's_start_stop_299999000028' ( ts, device_state )  USING s_start_stop values(  '2021-04-20 11:32:47.0', 1 )  ;

DB error: invalid SQL: 'values(  '2021-04-20 11:32:47.0', 1 )  ;' (keyword TAGS expected) (0.000230s)

![image](https://user-images.githubusercontent.com/38010908/115405271-acff5580-a220-11eb-9e78-4398a3ad292a.png)

也怀疑是资源限制的问题，尝试了不加限制，即是resources:{}，也尝试加限制内存2G，CPU 800m，但效果也是一样的，会卡住，证明和资源使用没有关系。

resources:
      limits:
        cpu: 800m
        memory: 2Gi
      requests:
        cpu: 250m
        memory: 512Mi

使用命令"jstack -F [pid]"进行分析，显示阻塞在"com.taosdata.jdbc.TSDBJNIConnector.executeQueryImp(byte[], long)"方法
```
Thread 76: (state = IN_NATIVE)
 - com.taosdata.jdbc.TSDBJNIConnector.executeQueryImp(byte[], long) @bci=0 (Compiled frame; information may be imprecise)
 - com.taosdata.jdbc.TSDBJNIConnector.executeQuery(java.lang.String) @bci=33, line=122 (Compiled frame)
 - com.taosdata.jdbc.TSDBStatement.executeUpdate(java.lang.String) @bci=23, line=100 (Compiled frame)
 - com.taosdata.jdbc.SavedPreparedStatement.executeSql(java.lang.String) @bci=5, line=450 (Compiled frame)
 - com.taosdata.jdbc.SavedPreparedStatement.executeBatchInternal() @bci=18, line=259 (Interpreted frame)
 - com.taosdata.jdbc.TSDBPreparedStatement.execute() @bci=11, line=304 (Interpreted frame)
 - com.zaxxer.hikari.pool.ProxyPreparedStatement.execute() @bci=14, line=44 (Compiled frame)
 - com.zaxxer.hikari.pool.HikariProxyPreparedStatement.execute() @bci=1 (Compiled frame)
 - sun.reflect.GeneratedMethodAccessor152.invoke(java.lang.Object, java.lang.Object[]) @bci=40 (Compiled frame)
 - sun.reflect.DelegatingMethodAccessorImpl.invoke(java.lang.Object, java.lang.Object[]) @bci=6, line=43 (Compiled frame)
 - java.lang.reflect.Method.invoke(java.lang.Object, java.lang.Object[]) @bci=56, line=498 (Compiled frame)
 - org.apache.ibatis.logging.jdbc.PreparedStatementLogger.invoke(java.lang.Object, java.lang.reflect.Method, java.lang.Object[]) @bci=127, line=59 (Compiled frame)
 - com.sun.proxy.$Proxy257.execute() @bci=9 (Interpreted frame)
 - org.apache.ibatis.executor.statement.PreparedStatementHandler.update(java.sql.Statement) @bci=6, line=47 (Interpreted frame)
 - org.apache.ibatis.executor.statement.RoutingStatementHandler.update(java.sql.Statement) @bci=5, line=74 (Interpreted frame)
 - sun.reflect.GeneratedMethodAccessor151.invoke(java.lang.Object, java.lang.Object[]) @bci=44 (Compiled frame)
 - sun.reflect.DelegatingMethodAccessorImpl.invoke(java.lang.Object, java.lang.Object[]) @bci=6, line=43 (Compiled frame)
 - java.lang.reflect.Method.invoke(java.lang.Object, java.lang.Object[]) @bci=56, line=498 (Compiled frame)
 - org.apache.ibatis.plugin.Plugin.invoke(java.lang.Object, java.lang.reflect.Method, java.lang.Object[]) @bci=63, line=63 (Compiled frame)
 - com.sun.proxy.$Proxy256.update(java.sql.Statement) @bci=16 (Compiled frame)
 - com.baomidou.mybatisplus.core.executor.MybatisSimpleExecutor.doUpdate(org.apache.ibatis.mapping.MappedStatement, java.lang.Object) @bci=46, line=54 (Interpreted frame)
 - org.apache.ibatis.executor.BaseExecutor.update(org.apache.ibatis.mapping.MappedStatement, java.lang.Object) @bci=47, line=117 (Interpreted frame)
 - org.apache.ibatis.executor.CachingExecutor.update(org.apache.ibatis.mapping.MappedStatement, java.lang.Object) @bci=11, line=76 (Interpreted frame)
 - org.apache.ibatis.session.defaults.DefaultSqlSession.update(java.lang.String, java.lang.Object) @bci=24, line=197 (Interpreted frame)
 - org.apache.ibatis.session.defaults.DefaultSqlSession.insert(java.lang.String, java.lang.Object) @bci=3, line=184 (Interpreted frame)
 - sun.reflect.GeneratedMethodAccessor146.invoke(java.lang.Object, java.lang.Object[]) @bci=52 (Interpreted frame)
 - sun.reflect.DelegatingMethodAccessorImpl.invoke(java.lang.Object, java.lang.Object[]) @bci=6, line=43 (Compiled frame)
 - java.lang.reflect.Method.invoke(java.lang.Object, java.lang.Object[]) @bci=56, line=498 (Compiled frame)
 - org.mybatis.spring.SqlSessionTemplate$SqlSessionInterceptor.invoke(java.lang.Object, java.lang.reflect.Method, java.lang.Object[]) @bci=30, line=433 (Interpreted frame)
 - com.sun.proxy.$Proxy156.insert(java.lang.String, java.lang.Object) @bci=20 (Interpreted frame)
 - org.mybatis.spring.SqlSessionTemplate.insert(java.lang.String, java.lang.Object) @bci=6, line=278 (Interpreted frame)
 - com.baomidou.mybatisplus.core.override.MybatisMapperMethod.execute(org.apache.ibatis.session.SqlSession, java.lang.Object[]) @bci=69, line=58 (Interpreted frame)
 - com.baomidou.mybatisplus.core.override.MybatisMapperProxy.invoke(java.lang.Object, java.lang.reflect.Method, java.lang.Object[]) @bci=60, line=62 (Interpreted frame)
 - com.sun.proxy.$Proxy161.insertOne(java.lang.String, java.lang.String, com.hg.device.kafka.tdengine.entity.SuperDeviceEntity) @bci=24 (Interpreted frame)
 - com.hg.device.kafka.server.service.impl.deviceCommandService.WinccStateMsgCommandServiceImpl.invoke(java.lang.String, byte[]) @bci=113, line=77 (Interpreted frame)
 - com.hg.device.kafka.server.service.impl.DeviceMessageInputServiceNoThreadPoolImpl.invoke(java.lang.String, java.lang.String) @bci=204, line=72 (Interpreted frame)
 - com.hg.device.kafka.server.service.experimental.NativeConsumerMessageInputService$2.process(org.apache.kafka.clients.consumer.ConsumerRecord) @bci=113, line=100 (Interpreted frame)
 - com.hg.device.kafka.server.service.experimental.MessageTask.run() @bci=68, line=44 (Interpreted frame)
 - java.util.concurrent.Executors$RunnableAdapter.call() @bci=4, line=511 (Interpreted frame)
 - java.util.concurrent.FutureTask.run() @bci=42, line=266 (Interpreted frame)
 - java.util.concurrent.ThreadPoolExecutor.runWorker(java.util.concurrent.ThreadPoolExecutor$Worker) @bci=95, line=1149 (Interpreted frame)
 - java.util.concurrent.ThreadPoolExecutor$Worker.run() @bci=5, line=624 (Interpreted frame)
 - java.lang.Thread.run() @bci=11, line=748 (Interpreted frame)
```

对卡住的容器（该pod 使用的虚拟网卡cali1313669b095）进行tcpdump抓包，显示，pod一直在向tdengnie发送数据 "UDP, length 120"，但是，tdengine一直都是回复"UDP, length 741"（这个应该是常规心跳？），是否意味着，最后的方法executeQueryImp把数据发给tdengine之后没有得到受影响行数的回复，从而不断重试，阻塞了线程？

```
root@uat-worker-2:~# tcpdump -i cali1313669b095
tcpdump: verbose output suppressed, use -v or -vv for full protocol decode
listening on cali1313669b095, link-type EN10MB (Ethernet), capture size 262144 bytes
15:29:58.684433 IP 169.122.240.19.49638 > uat-worker-3.6030: UDP, length 120
15:29:58.684445 IP 169.122.240.19.43753 > uat-worker-3.6030: UDP, length 120
15:29:58.684854 IP uat-worker-3.6030 > 169.122.240.19.49638: UDP, length 741
15:29:58.684861 IP uat-worker-3.6030 > 169.122.240.19.43753: UDP, length 741
15:29:58.694437 IP 169.122.240.19.49638 > uat-worker-3.6030: UDP, length 120
15:29:58.694676 IP uat-worker-3.6030 > 169.122.240.19.49638: UDP, length 741
15:29:58.724539 IP 169.122.240.19.49638 > uat-worker-3.6030: UDP, length 120
15:29:58.724547 IP 169.122.240.19.43753 > uat-worker-3.6030: UDP, length 120
15:29:58.724785 IP uat-worker-3.6030 > 169.122.240.19.43753: UDP, length 741
15:29:58.724814 IP uat-worker-3.6030 > 169.122.240.19.49638: UDP, length 741
```
我的taos-jdbcdriver是2.0.18（com.taosdata.jdbc:taos-jdbcdriver:2.0.18）。

参考文档，"TDengine实现了自己的超时、重传、确认等机制"，是否在udp传输的超时，重传，确认等机制需要重新review？
```
https://www.taosdata.com/cn/documentation/architecture
通讯方式：TDengine系统的各个数据节点之间，以及应用驱动与各数据节点之间的通讯是通过TCP/UDP进行的。因为考虑到物联网场景，数据写入的包一般不大，因此TDengine 除采用TCP做传输之外，还采用UDP方式，因为UDP 更加高效，而且不受连接数的限制。TDengine实现了自己的超时、重传、确认等机制，以确保UDP的可靠传输。对于数据量不到15K的数据包，采取UDP的方式进行传输，超过15K的，或者是查询类的操作，自动采取TCP的方式进行传输。同时，TDengine根据配置和数据包，会自动对数据进行压缩/解压缩，数字签名/认证等处理。对于数据节点之间的数据复制，只采用TCP方式进行数据传输。
```

大家有没有遇到类似问题，我可以怎样判定是k8s网络环境的原因，还是tdengine连接心跳的原因？

**Comment by MCC1MCC** [comment]
我也遇到了相同问题

**Comment by zitsen** [comment]
Try `rpcForceTcp 1` in /etc/taos/taos.cfg, it will force use tcp instead of UDP connections.

**Comment by fenghuazzm** [comment]
This issue was closed because it has been inactive for too many days.
